period_label,year_from,year_to,product_code,product_name,unit,quantity_from,value_from,quantity_to,value_to
I կիսամյակ 2020-2021,2020,2021,5703,Գորգեր եւ այլ մանածագործ հատակի ծածկույթներ դիպակային,հազ.քմ,57.7,365.7,145.2,682.8
I կիսամյակ 2020-2021,2020,2021,5704,"Գորգեր եւ այլ մանածագործ հատակի ծածկույթներ թաղիքից, ոչ դիպակային կամ չֆլոկիրացված",հազ.քմ,1.5,7.6,3.4,8.2
I կիսամյակ 2020-2021,2020,2021,5705,Գորգեր եւ այլ մանածագործ հատակի ծածկույթներ այլ,հազ.քմ,55.5,319.5,30.0,213.1
I կիսամյակ 2020-2021,2020,2021,5801,Գործվածք մազախավից եւ թավաթելից` ոչ 5802 կամ 5806 դիրքերի,հազ.քմ,26.6,63.9,53.7,161.4
I կիսամյակ 2020-2021,2020,2021,5802,Գործվածք խավավոր սրբիչային; դիպակային մանածագործ նյութեր` ոչ 5703 դիրքում նշած,հազ.քմ,34.3,48.5,88.1,165.7
I կիսամյակ 2020-2021,2020,2021,5803,Գործվածք ոլորազարդ հյուսվածքով,քմ,0.1,0.0,0.0,0.0
I կիսամյակ 2020-2021,2020,2021,5804,"Շղարշ եւ այլ ցանցահյուս պաստառներ; ժանյակներ, ոչ 6002-6006 դիրքերի",տոննա,44.4,295.4,46.0,350.7
I կիսամյակ 2020-2021,2020,2021,5805,Ձեռագործ գոբելեններ եւ գոբելեններ գործած ասեղով,կգ,80.0,0.4,3.9,0.8
I կիսամյակ 2020-2021,2020,2021,5806,Նեղ գործվածք` ոչ 5807 դիրքում նշված,տոննա,62.8,936.7,82.0,1525.0
I կիսամյակ 2020-2021,2020,2021,5807,"Պիտակ, խորհրդանշան եւ նման իրեր մանածագործ նյութերից",տոննա,5.2,501.8,8.1,713.1
I կիսամյակ 2020-2021,2020,2021,5808,Հյուսած ժապավենաթել; հարդարման նյութեր չասեղնագործած; ծոպքեր,տոննա,7.2,131.7,11.4,162.8
I կիսամյակ 2020-2021,2020,2021,5809,Գործվածք մետաղյա եւ մետաղազօծ թելերով,կգ,354.7,1.1,34.5,2.5
I կիսամյակ 2020-2021,2020,2021,5810,"Ասեղնագործեր կտորով, ժապավեններով կամ առանձին նախշազարդերի տեսքով",կգ,261.2,56.8,861.3,63.0
I կիսամյակ 2020-2021,2020,2021,5811,Մգդակած մանածագործ նյութեր,հազ.քմ,107.2,118.0,368.2,822.3
I կիսամյակ 2020-2021,2020,2021,5901,Մանածագործ նյութեր` խեժապատ կամ օսլայած,հազ.քմ,17.6,43.6,20.2,45.4
I կիսամյակ 2020-2021,2020,2021,5902,"Նյութեր` կորդային, ավտոդողերի համար",հազ.քմ,7.4,34.9,0.0,0.0
I կիսամյակ 2020-2021,2020,2021,5903,"Մանածագործ նյութեր ներծծված, ծածկույթով կամ կրկնորդած պլաստմասսայով",հազ.քմ,1262.4,3863.0,1897.0,6295.8
I կիսամյակ 2020-2021,2020,2021,5904,Լինոլեում; հատակի ծածկույթներ մանածագործ հիմքի վրա,հազ.քմ,92.1,161.7,187.0,318.7
I կիսամյակ 2020-2021,2020,2021,5905,Պատի ծածկույթներ մանածագործ նյութերից,քմ,2826.6,17.4,486.9,20.9
I կիսամյակ 2020-2021,2020,2021,5906,Մանածագործ նյութեր ռետինացված,տոննա,6.2,14.1,5.9,20.0
I կիսամյակ 2020-2021,2020,2021,5907,Մանածագործ նյութեր; նկարազարդ կտավ,հազ.քմ,45.4,363.6,66.6,526.6
I կիսամյակ 2020-2021,2020,2021,5908,Պատրույգներ մանածագործ; շիկացման ցանցեր,կգ,3.1,0.3,145.2,1.8
I կիսամյակ 2020-2021,2020,2021,5909,"Մանածագործ ճկափող, փողրակ",տոննա,45.4,272.3,30.2,81.9
I կիսամյակ 2020-2021,2020,2021,5910,"Փոխակրիչ ժապավեններ կամ շարժափոկեր կամ բելտինգ, մանածագործ նյութերից",կգ,1192.2,80.3,859.8,52.0
I կիսամյակ 2020-2021,2020,2021,5911,Մանածագործ նյութեր եւ իրեր տեխնիկական նպատակների համար,տոննա,20.3,273.9,19.9,251.7
I կիսամյակ 2020-2021,2020,2021,5911,Մանածագործ նյութեր եւ իրեր տեխնիկական նպատակների համար,քմ,95.6,3.8,300.0,4.8
I կիսամյակ 2020-2021,2020,2021,6001,Նրբախավ պաստառ,տոննա,18.4,93.8,59.4,307.2
I կիսամյակ 2020-2021,2020,2021,6002,"Տրիկոտաժե պաստառ` <30սմ լայնությամբ, >= 5 զանգ.% էլաստիկ կամ ռետինե թելերի պարունակությամբ",կգ,234.5,2.6,8984.4,19.3
I կիսամյակ 2020-2021,2020,2021,6003,"Տրիկոտաժե պաստառ` <30սմ լայնությամբ, ոչ 6001 դիրքում նշած",տոննա,1.7,36.0,16.4,90.1
I կիսամյակ 2020-2021,2020,2021,6004,"Տրիկոտաժե պաստառ` >=30սմ լայնությամբ, >= 5 զանգ.% էլաստիկ կամ ռետինե թելերի պարունակությամբ, ոչ 6001, 6002 դիրքերում նշած",տոննա,13.5,94.5,47.8,384.0
I կիսամյակ 2020-2021,2020,2021,6005,Պաստառներ հիմքագործքային,տոննա,327.7,828.9,624.4,1483.0
I կիսամյակ 2020-2021,2020,2021,6006,Այլ տրիկոտաժե պաստառներ,տոննա,678.4,3579.3,1171.3,5082.0
I կիսամյակ 2020-2021,2020,2021,6101,"Վերարկու, թիկնոց, անձրեւանոց, բաճկոններ եւ նման տրիկոտաժե հագուստ տղամարդու կամ տղայի, ոչ 6103 դիրքի",հազ.հատ,18.0,312.8,12.5,225.1
I կիսամյակ 2020-2021,2020,2021,6102,"Վերարկու, թիկնոց, անձրեւանոց, բաճկոններ եւ նման տրիկոտաժե հագուստ կնոջ կամ աղջկա, ոչ 6104 դիրքի",հազ.հատ,14.2,289.5,15.7,251.3
I կիսամյակ 2020-2021,2020,2021,6103,"Կոստյում, պիջակ, բլայզեր, տաբատ եւ նման տրիկոտաժե հագուստ տղամարդու կամ տղայի",հազ.հատ,105.6,981.9,174.4,1278.0
I կիսամյակ 2020-2021,2020,2021,6104,"Կոստյում, ժակետ, բլայզեր, զգեստ, փեշ եւ նման տրիկոտաժե հագուստ կնոջ կամ աղջկա",հազ.հատ,344.5,2666.0,483.9,3077.3
I կիսամյակ 2020-2021,2020,2021,6105,Վերնաշապիկներ տրիկոտաժե տղամարդու կամ տղայի,հազ.հատ,141.6,1167.3,183.2,1715.7
I կիսամյակ 2020-2021,2020,2021,6106,"Բլուզկաներ, բլուզներ եւ բլուզոններ տրիկոտաժե կնոջ կամ աղջկա",հազ.հատ,64.2,386.2,121.4,523.6
I կիսամյակ 2020-2021,2020,2021,6107,"Փոխան, վարտիք, պիժամա, խալաթ եւ նման տրիկոտաժե արտադրանք տղամարդու կամ տղայի",հազ.հատ,292.3,349.3,577.6,630.0
I կիսամյակ 2020-2021,2020,2021,6108,"Կոմբինացիա, պանտալոն, գիշերաշապիկ, խալաթ եւ նման տրիկոտաժե արտադրանք կնոջ կամ աղջկա",հազ.հատ,395.8,568.6,1060.8,965.3
I կիսամյակ 2020-2021,2020,2021,6109,"Մայկա, ֆուֆայկա եւ նմանատիպ արտադրանք այլ` տրիկոտաժե",հազ.հատ,745.7,3903.7,1180.0,4893.0
I կիսամյակ 2020-2021,2020,2021,6110,"Սվիտեր, պուլովեր, կարդիգան, ժիլետ եւ նման արտադրանք տրիկոտաժե",հազ.հատ,325.6,4370.1,331.7,5057.4
I կիսամյակ 2020-2021,2020,2021,6111,"Մանկական հագուստ եւ դրանց պարագաներ, տրիկոտաժե",զույգ,350.0,0.5,1207.0,1.4
I կիսամյակ 2020-2021,2020,2021,6111,"Մանկական հագուստ եւ դրանց պարագաներ, տրիկոտաժե",տոննա,73.6,1203.2,52.0,1188.7
I կիսամյակ 2020-2021,2020,2021,6112,"Կոստյումներ մարզական, դահուկային եւ լողի, տրիկոտաժե",հազ.հատ,100.3,749.4,147.7,1092.2
I կիսամյակ 2020-2021,2020,2021,6113,"Հագուստ 5903, 5906 կամ 5907 դիրքերի տրիկոտաժե պաստառից",տոննա,3.9,82.3,4.0,87.3
I կիսամյակ 2020-2021,2020,2021,6114,"Հագուստի առարկաներ այլ, տրիկոտաժե",տոննա,1305.4,11497.5,124.4,1121.3
I կիսամյակ 2020-2021,2020,2021,6115,"Զուգագուլպա եւ այլ գուլպա-կիսագուլպային արտադրանք եւ կոշիկ առանց տակերի, տրիկոտաժե",հազ.զույգ,2181.4,671.3,3419.4,1796.3
I կիսամյակ 2020-2021,2020,2021,6115,"Զուգագուլպա եւ այլ գուլպա-կիսագուլպային արտադրանք եւ կոշիկ առանց տակերի, տրիկոտաժե",հազ.հատ,790.0,712.5,828.6,798.6
I կիսամյակ 2020-2021,2020,2021,6116,"Ձեռնոց, թաթման եւ միտենկա, տրիկոտաժե",հազ.զույգ,741.1,240.8,955.6,241.9
I կիսամյակ 2020-2021,2020,2021,6117,Հագուստի պատրաստի այլ պարագաներ եւ մասեր տրիկոտաժե,հազ.հատ,26.0,36.9,15.4,21.9
I կիսամյակ 2020-2021,2020,2021,6117,Հագուստի պատրաստի այլ պարագաներ եւ մասեր տրիկոտաժե,տոննա,101.9,345.5,165.6,449.6
I կիսամյակ 2020-2021,2020,2021,6201,"Վերարկու, թիկնոց, անձրեւանոց, բաճկոն եւ նման հագուստ տղամարդու կամ տղայի, բացի 6203 դիրքի",հազ.հատ,57.3,1833.9,93.1,2568.3
I կիսամյակ 2020-2021,2020,2021,6202,"Վերարկու, թիկնոց, անձրեւանոց, բաճկոն եւ նման հագուստ կնոջ կամ աղջկա, բացի 6204 դիրքի",հազ.հատ,70.9,2461.0,86.3,2492.3
I կիսամյակ 2020-2021,2020,2021,6203,"Կոստյում, պիջակ, բլայզեր, տաբատ եւ նման հագուստ տղամարդու կամ տղայի",հազ.հատ,244.7,4486.2,601.4,6455.2
I կիսամյակ 2020-2021,2020,2021,6204,"Կոստյում, ժակետ, բլայզեր, զգեստ, փեշ եւ նման հագուստ կնոջ կամ աղջկա",հազ.հատ,423.0,7694.2,855.6,9940.6
I կիսամյակ 2020-2021,2020,2021,6205,Վերնաշապիկներ տղամարդու կամ տղայի,հազ.հատ,91.1,1446.9,163.1,1444.4
I կիսամյակ 2020-2021,2020,2021,6206,"Բլուզկաներ, բլուզներ եւ բլուզոններ կնոջ կամ աղջկա",հազ.հատ,133.9,1598.0,307.2,2102.6
I կիսամյակ 2020-2021,2020,2021,6207,"Մայկա եւ մարմնահագի ֆուֆայկա, վարտիք, խալաթ եւ նման արտադրանք տղամարդու կամ տղայի",կգ,193.8,2.4,667.4,10.9
I կիսամյակ 2020-2021,2020,2021,6207,"Մայկա եւ մարմնահագի ֆուֆայկա, վարտիք, խալաթ եւ նման արտադրանք տղամարդու կամ տղայի",հազ.հատ,7.6,26.4,9.3,19.1
I կիսամյակ 2020-2021,2020,2021,6208,"Մայկա եւ մարմնահագի ֆուֆայկա, պանտալոն, պենյուար, խալաթ եւ նման արտադրանք կնոջ կամ աղջկա",կգ,901.0,42.5,2185.0,65.9
I կիսամյակ 2020-2021,2020,2021,6208,"Մայկա եւ մարմնահագի ֆուֆայկա, պանտալոն, պենյուար, խալաթ եւ նման արտադրանք կնոջ կամ աղջկա",հազ.հատ,36.0,84.0,103.4,230.3
I կիսամյակ 2020-2021,2020,2021,6209,Մանկական հագուստ եւ դրանց պարագաներ,տոննա,13.0,322.7,19.8,373.2
I կիսամյակ 2020-2021,2020,2021,6210,Հագուստի առարկաներ,հատ,813.0,17.0,859.0,17.7
I կիսամյակ 2020-2021,2020,2021,6210,Հագուստի առարկաներ,տոննա,20.1,497.5,46.2,1186.2
I կիսամյակ 2020-2021,2020,2021,6211,"Կոստյումներ մարզական, դահուկային եւ լողի; հագուստի պարագաներ այլ",հազ.հատ,6.0,119.9,16.4,200.8
I կիսամյակ 2020-2021,2020,2021,6211,"Կոստյումներ մարզական, դահուկային եւ լողի; հագուստի պարագաներ այլ",տոննա,892.1,466.2,45.0,808.5
I կիսամյակ 2020-2021,2020,2021,6212,"Կրծկալ, գոտի, սեղմիրան, տաբատակալ եւ նման արտադրանք եւ դրանց մասեր",կգ,2979.6,25.5,934.8,22.4
I կիսամյակ 2020-2021,2020,2021,6212,"Կրծկալ, գոտի, սեղմիրան, տաբատակալ եւ նման արտադրանք եւ դրանց մասեր",հազ.հատ,151.9,418.8,506.7,910.9
I կիսամյակ 2020-2021,2020,2021,6213,Թաշկինակներ,հազ.հատ,5.0,9.2,205.0,61.7
I կիսամյակ 2020-2021,2020,2021,6214,"Շալ, վզնոց, կաշնե, թիկնոց, քող եւ նման արտադրանք",հազ.հատ,107.6,168.9,41.4,169.6
I կիսամյակ 2020-2021,2020,2021,6215,"Փողկապ, թիթեռնիկ-փողկապ եւ վզի թաշկինակ",հազ.հատ,2.6,17.5,3.7,37.5
I կիսամյակ 2020-2021,2020,2021,6216,"Ձեռնոց, թաթման եւ միտենկա",տոննա,7.2,42.8,3.5,23.0
I կիսամյակ 2020-2021,2020,2021,6217,Հագուստի այլ պարագաներ եւ մասեր` ոչ 6212 դիրքի,տոննա,10.3,375.5,19.0,687.2
I կիսամյակ 2020-2021,2020,2021,6301,Վերմակներ եւ ճանապարհորդային պլեդներ,հազ.հատ,67.0,198.5,203.7,522.1
I կիսամյակ 2020-2021,2020,2021,6302,"Սպիտակեղեն անկողնու, ճաշի, զուգարանային եւ խոհանոցի",տոննա,568.4,1349.9,392.1,1412.6
I կիսամյակ 2020-2021,2020,2021,6303,Վարագույրներ; լամբրեկեններ կամ եզրազարդեր մահճակալների համար,հազ.քմ,37.7,117.3,90.1,92.2
I կիսամյակ 2020-2021,2020,2021,6304,"Զարդային այլ արտադրանք, բացի 9404 դիրքում նշածները",հազ.հատ,66.0,143.3,29.3,110.0
I կիսամյակ 2020-2021,2020,2021,6304,"Զարդային այլ արտադրանք, բացի 9404 դիրքում նշածները",տոննա,12.8,45.6,40.4,341.5
I կիսամյակ 2020-2021,2020,2021,6305,Պարկեր եւ ծրարներ փաթեթավորման,տոննա,973.2,1456.2,1003.9,1353.7
I կիսամյակ 2020-2021,2020,2021,6306,"Բրեզենտ, ծածկ, տենտ; վրան; առագաստ; հանդերձանք քեմփինգի համար",հատ,172.0,3.5,375.0,8.7
I կիսամյակ 2020-2021,2020,2021,6306,"Բրեզենտ, ծածկ, տենտ; վրան; առագաստ; հանդերձանք քեմփինգի համար",տոննա,86.3,307.1,91.2,228.9
I կիսամյակ 2020-2021,2020,2021,6307,"Այլ պատրաստի նյութեր, ներառյալ հագուստի ձեւվածքներ",տոննա,1118.3,2955.1,346.2,2268.5
I կիսամյակ 2020-2021,2020,2021,6308,"Կոմպլեկտներ գորգ, սփռոց, անձեռոցիկ եւ նման մանածագործ իրեր պատրաստելու, փաթեթավորած",կգ,520.8,14.2,9.1,0.1
I կիսամյակ 2020-2021,2020,2021,6309,Հագուստ եւ այլ արտադրանք օգտագործված,տոննա,190.9,1174.8,419.1,2144.4
I կիսամյակ 2020-2021,2020,2021,6310,"Լաթեղեն` օգտագործած կամ նոր, օգտագործած թոկերի, ճոպանի եւ կառասանի կտորներ եւ արտադրանք դրանցից",տոննա,5.0,5.3,41.8,47.4
I կիսամյակ 2020-2021,2020,2021,6401,Անջրանցիկ կոշիկ կոշկատակով եւ կոշկերեսը ռետինից կամ պլաստմասսայից,հազ.զույգ,64.6,312.7,74.8,130.7
I կիսամյակ 2020-2021,2020,2021,6402,Այլ տեսակներ կոշիկի կոշկատակով եւ կոշկերեսը ռետինից կամ պլաստմասսայից,հազ.զույգ,2124.3,10184.6,2212.8,11139.7
I կիսամյակ 2020-2021,2020,2021,6403,"Կոշիկ կոշկատակը ռետինից, պլաստմասսայիցից, բնական կամ արհեստական կաշվից, երեսը բնական կաշվից",հազ.զույգ,264.1,5043.6,181.0,3826.7
I կիսամյակ 2020-2021,2020,2021,6404,"Կոշիկ կոշկատակը ռետինից, պլաստմասսայից, բնական կամ արհեստական կաշվից, երեսը մանածագործ նյութերից",հազ.զույգ,917.0,4479.0,1662.6,8773.9
I կիսամյակ 2020-2021,2020,2021,6405,Կոշիկ այլ,հազ.զույգ,129.5,258.1,139.6,239.5
I կիսամյակ 2020-2021,2020,2021,6406,"Մասեր կոշիկի, դնովի միջադիր եւ նման իրեր; գետրի, գամաշ եւ դրանց մասեր",հազ.զույգ,29.5,7.0,12.6,4.8
I կիսամյակ 2020-2021,2020,2021,6406,"Մասեր կոշիկի, դնովի միջադիր եւ նման իրեր; գետրի, գամաշ եւ դրանց մասեր",տոննա,164.2,612.4,237.3,887.0
I կիսամյակ 2020-2021,2020,2021,6504,Լայնեզր գլխարկ եւ այլ գլխարկ հյուսած կամ պատրաստած տարբեր նյութերից շերտերի միացմամբ,հազ.հատ,50.6,46.7,80.5,59.1
I կիսամյակ 2020-2021,2020,2021,6505,"Լայնեզր գլխարկ եւ այլ գլխարկ, տրիկոտաժե, նրբաթաղիքից կամ այլ մանածագործ նյութից; մազի ցանց",հազ.հատ,190.8,158.0,184.0,256.5
I կիսամյակ 2020-2021,2020,2021,6505,"Լայնեզր գլխարկ եւ այլ գլխարկ, տրիկոտաժե, նրբաթաղիքից կամ այլ մանածագործ նյութից; մազի ցանց",տոննա,16.0,198.5,24.9,352.8
I կիսամյակ 2020-2021,2020,2021,6506,Այլ գլխարկներ,հազ.հատ,292.6,152.2,721.2,156.7
I կիսամյակ 2020-2021,2020,2021,6506,Այլ գլխարկներ,տոննա,2.0,18.2,2.4,22.5
I կիսամյակ 2020-2021,2020,2021,6507,"Ժապավեններ, աստառներ, ծածկեր, հիմքեր, հենքեր, հովարներ եւ կապեր գլխարկների համար",կգ,944.2,7.8,1433.8,6.8
I կիսամյակ 2020-2021,2020,2021,6601,Հովանոցներ եւ արեւապաշտպան հովանոցներ,հազ.հատ,106.8,362.2,38.2,368.0
I կիսամյակ 2020-2021,2020,2021,6602,"Ձեռնափայտ, խարազան, մտրակ ձիավարման համար եւ համանման իրեր",հազ.հատ,50.2,215.7,6.8,27.8
I կիսամյակ 2020-2021,2020,2021,6603,"Մասեր, զարդարանքներ եւ պարագաներ 6601 կամ 6602 դիրքերում նշածների համար",տոննա,1.6,4.8,6.5,19.2
I կիսամյակ 2020-2021,2020,2021,6701,"Մորթիկներ եւ այլ մասեր թռչունների`փետուրով կամ բմբուլով, փետուր եւ իրեր դրանցից",կգ,24.5,0.5,49.6,0.8
I կիսամյակ 2020-2021,2020,2021,6702,"Ծաղիկ, տերեւ, պտուղ արհեստական եւ արտադրանք դրանցից",տոննա,56.2,322.3,65.2,162.5
I կիսամյակ 2020-2021,2020,2021,6703,Մարդու մազ; բուրդ կամ այլ մազ կենդանու կամ այլ մանածագործ նյութեր` կեղծամի համար,կգ,8.0,3.5,18.0,9.0
I կիսամյակ 2020-2021,2020,2021,6704,"Կեղծամ, դնովի մորուք, հոնք եւ թարթիչ եւ նման իրեր",կգ,3120.0,14.9,354.8,26.3
I կիսամյակ 2020-2021,2020,2021,6801,"Սալաքար, եզրաքար եւ սալիկ բնական քարից սալարկման համար (բացի թերթաքար)",տոննա,10.3,1.4,0.0,0.0
I կիսամյակ 2020-2021,2020,2021,6802,"Հուշարձանի եւ շինարարության համար մշակած քար (ոչ թերթաքար) եւ արտադրանք դրանից; հատիկ, եւ փոշի` (ներառ. թերթաքար) բնական քարից",տոննա,3544.5,1547.0,4840.5,2194.8
I կիսամյակ 2020-2021,2020,2021,6803,Թերթաքար բնական` մշակված,տոննա,84.7,58.6,1.3,6.9
I կիսամյակ 2020-2021,2020,2021,6804,"Ջրաղացքար, սրելու քար, հղկող սկավառակ եւ նման արտադրանք",տոննա,218.3,906.1,310.4,981.9
I կիսամյակ 2020-2021,2020,2021,6805,"Բնական կամ արհեստական հղկող փոշի կամ հատիկ գործվածքե, թղթե, ստվարաթղթե կամ այլ հիմքի վրա",տոննա,50.7,378.9,75.0,273.4
I կիսամյակ 2020-2021,2020,2021,6806,"Խարամաբամբակ, հանքաբամբակ; վերմիկուլիտ",տոննա,631.9,540.5,987.3,1056.9
I կիսամյակ 2020-2021,2020,2021,6807,Արտադրանք ասֆալտից կամ նման նյութերից,հազ.քմ,440.7,718.3,865.4,2798.2
I կիսամյակ 2020-2021,2020,2021,6807,Արտադրանք ասֆալտից կամ նման նյութերից,տոննա,140.8,60.5,322.1,127.9
I կիսամյակ 2020-2021,2020,2021,6808,"Պանել, սալիկ, բլոկ` բուսական մանրաթելից, տաշեղից, թեփից եւ փայտի այլ թափոնից` ագլոմերացված ցեմենտով կամ այլ հանքային կապակցանյութերով",տոննա,108.5,66.8,48.9,16.1
I կիսամյակ 2020-2021,2020,2021,6809,Ատադրանք գիպսից կամ խառնուրդներից գիպսե հիմքով,հազ.քմ,2688.2,2777.3,2521.1,2759.8
I կիսամյակ 2020-2021,2020,2021,6809,Ատադրանք գիպսից կամ խառնուրդներից գիպսե հիմքով,տոննա,1.5,3.3,3.8,11.4
I կիսամյակ 2020-2021,2020,2021,6810,"Արտադրանք ցեմենտից, բետոնից կամ արհեստական քարից",տոննա,681.8,255.8,1967.8,610.5
I կիսամյակ 2020-2021,2020,2021,6811,"Արտադրանք ասբոցեմենտից, ցեմենտից թաղանթանյութի մանրաթելերի հետ եւ նման նյութերից",տոննա,34.7,5.5,12.9,4.7
I կիսամյակ 2020-2021,2020,2021,6812,Ասբեստային մշակված մանրաթել եւ արտադրանք դրանից,տոննա,37.6,63.2,44.9,195.4
I կիսամյակ 2020-2021,2020,2021,6813,Շփական նյութեր եւ արտադրանք դրանցից,տոննա,24.1,76.8,19.5,93.1
I կիսամյակ 2020-2021,2020,2021,6814,Փայլար մշակված եւ արտադրանք դրանից,կգ,2418.3,35.9,214.9,8.2
I կիսամյակ 2020-2021,2020,2021,6815,Արտադրանք քարից եւ այլ հանքանյութից,տոննա,146.2,448.6,26.7,301.8
I կիսամյակ 2020-2021,2020,2021,6901,"Աղյուս, բլոկներ եւ խեցեգործ այլ արտադրանք կավահողից",կգ,47428.0,22.8,585.0,0.3
I կիսամյակ 2020-2021,2020,2021,6902,Հրակայուն աղյուս եւ խեցեգործ շինարարական նյութեր,տոննա,753.8,693.3,1019.7,741.9
I կիսամյակ 2020-2021,2020,2021,6903,Այլ հրակայուն խեցեգործ արտադրանք,տոննա,39.4,170.4,53.2,231.8
I կիսամյակ 2020-2021,2020,2021,6904,Աղյուս շինարարական եւ նման արտադրանք` խեցեգործ,մլն հատ,1.7,0.7,74.7,17.2
I կիսամյակ 2020-2021,2020,2021,6907,Սալիկներ երեսպատման խեցեգործ` չջնարակած,հազ.քմ,2178.8,9511.2,2176.7,9569.0
I կիսամյակ 2020-2021,2020,2021,6909,"Ամանեղեն խեցեգործ` տեխնիկական, գյուղատնտեսական նպատակների համար",տոննա,39.3,127.0,25.4,165.6
I կիսամյակ 2020-2021,2020,2021,6910,"Լվացարան, լողարան եւ նման սան-տեխնիկական արտադրանք` խեցեգործ",հազ.հատ,110.6,2159.5,115.7,1953.8
I կիսամյակ 2020-2021,2020,2021,6911,"Ամանեղեն ճաշի, խոհանոցի եւ այլ տնտեսական արտադրանք` ճենապակուց",տոննա,31.6,326.5,51.8,558.7
I կիսամյակ 2020-2021,2020,2021,6912,"Ամանեղեն ճաշի, խոհանոցի եւ այլ տնտեսական արտադրանք` ոչ ճենապակե",տոննա,1099.0,2031.9,1202.8,2256.3
I կիսամյակ 2020-2021,2020,2021,6913,Արձանիկ եւ այլ զարդարանք խեցեգործ,տոննա,22.9,115.2,12.8,85.5
I կիսամյակ 2020-2021,2020,2021,6914,Այլ խեցեգործ արտադրանք,տոննա,29.9,156.5,3.2,26.2
I կիսամյակ 2020-2021,2020,2021,7001,Ջարդոն ապակու; ապակի բլոկներով,տոննա,173.6,34.7,996.0,199.2
I կիսամյակ 2020-2021,2020,2021,7002,Ապակի գնդա- խողովակաձեւ` անմշակ,կգ,269.4,41.3,306.0,43.0
I կիսամյակ 2020-2021,2020,2021,7003,"Ապակի ձուլածո եւ գլանված, թերթերով կամ պրոֆիլավորած",հազ.քմ,3.2,11.9,2.2,6.4
I կիսամյակ 2020-2021,2020,2021,7004,"Ապակի ձգած կամ փչած, թերթերով",հազ.քմ,4.3,12.2,1.6,3.1
I կիսամյակ 2020-2021,2020,2021,7005,"Ապակի ջերմահղկած եւ ողորկած կամ փայլեցրած մակերեսով, թերթերով",հազ.քմ,684.1,1937.0,840.0,2356.0
I կիսամյակ 2020-2021,2020,2021,7006,"Ապակի ճկած, փորագրած, շաղափած, արծնապատ կամ մշակած որեւէ այլ եղանակով",տոննա,35.7,51.1,75.5,142.0
I կիսամյակ 2020-2021,2020,2021,7007,Ապակի անվտանգ,հազ.քմ,145.7,238.2,155.6,362.3
I կիսամյակ 2020-2021,2020,2021,7007,Ապակի անվտանգ,տոննա,128.5,273.7,151.5,341.8
I կիսամյակ 2020-2021,2020,2021,7008,Ապակուց բազմաշերտ մեկուսիչ արտադրանք,հազ.քմ,2.5,67.1,2.5,122.8
