period_label,year_from,year_to,product_code,product_name,unit,quantity_from,value_from,quantity_to,value_to
2020-2021,2020,2021,8442,"Մեքենա, ապարատուրա տպագրական ձեւերի պատրաստման; թիթեղ, գլան, վիմագրական քար տպագրության համար",տոննա,262.6,708.2,614.7,664.2
2020-2021,2020,2021,8443,"Տպագրական սարքավորում; այլ տպիչ, պատճենահան եւ ֆաքսիմիլային ապարատ, դրանց մասեր",հազ.հատ,390.1,5633.0,21.6,5398.7
2020-2021,2020,2021,8443,"Տպագրական սարքավորում; այլ տպիչ, պատճենահան եւ ֆաքսիմիլային ապարատ, դրանց մասեր",տոննա,384.1,2289.6,501.9,1773.6
2020-2021,2020,2021,8444,"Մեքենա արհեստական մանածագործ նյութերի արտա -մղման, -ձգման, տեքստուրավորման կամ կտրման",հատ,2.0,0.1,0.0,0.0
2020-2021,2020,2021,8445,Մեքենա մանածագործ թելերի նախապատրաստման համար; բոժոժակծկիչ կամ կծկիչ,հատ,15.0,87.2,518.0,114.9
2020-2021,2020,2021,8446,Հաստոց` գործող,հատ,7.0,19.4,7.0,579.1
2020-2021,2020,2021,8447,"Մեքենա տրիկոտաժային, գործող-եզրակարող եւ նրբաթաղիքային",հազ.հատ,1.2,3122.8,16.1,3551.4
2020-2021,2020,2021,8448,Սարքավորում օժանդակ; մասեր` 8444-8447 դիրքերի մեքենաների,տոննա,5.9,83.9,44.3,489.4
2020-2021,2020,2021,8449,"Սարքավորում` թաղիքի, նրբաթաղիքի կամ չգործած նյութի, գլխարկի արտադրության; կաղապար գլխարկ պատրաստելու",տոննա,4.0,298.9,13.2,216.0
2020-2021,2020,2021,8450,Մեքենաներ լվացքի,հազ.հատ,36.2,8012.2,47.3,11197.1
2020-2021,2020,2021,8450,Մեքենաներ լվացքի,տոննա,2.8,33.9,1.9,25.2
2020-2021,2020,2021,8451,"Սարքավորում լվալու, արդուկման, ներկման, մշակման, մանվածքի, նյութերի ծածկապատման; մանածագործ գործվածքի կծկման, կտրման, ծակման",կգ,1629.4,23.8,438.9,18.9
2020-2021,2020,2021,8451,"Սարքավորում լվալու, արդուկման, ներկման, մշակման, մանվածքի, նյութերի ծածկապատման; մանածագործ գործվածքի կծկման, կտրման, ծակման",հազ.հատ,2.6,1109.5,2.6,1879.4
2020-2021,2020,2021,8452,Մեքենա կարի; կահույք` հատուկ կարի մեքենայի; ասեղ կարի մեքենայի,հազ.հատ,20.7,2561.4,26.4,4044.0
2020-2021,2020,2021,8452,Մեքենա կարի; կահույք` հատուկ կարի մեքենայի; ասեղ կարի մեքենայի,մլն հատ,20.7,78.1,12.7,81.0
2020-2021,2020,2021,8452,Մեքենա կարի; կահույք` հատուկ կարի մեքենայի; ասեղ կարի մեքենայի,տոննա,21.4,118.0,20.7,125.5
2020-2021,2020,2021,8453,"Սարքավորում մորթու կամ կաշվի նախապատրաստման կամ կաշվից կամ մորթուց կոշիկ կամ այլ իրեր պատրաստելու, ոչ կարի մեքենա",կգ,244.1,9.7,107.2,11.4
2020-2021,2020,2021,8453,"Սարքավորում մորթու կամ կաշվի նախապատրաստման կամ կաշվից կամ մորթուց կոշիկ կամ այլ իրեր պատրաստելու, ոչ կարի մեքենա",հատ,55.0,324.4,70.0,44.1
2020-2021,2020,2021,8454,"Կոնվերտեր, ձուլաշերեփ, կոճղակաղապար, ձուլամեքենա` օգտագործվող մետալուրգիայում",հատ,18.0,365.1,262.0,165.7
2020-2021,2020,2021,8454,"Կոնվերտեր, ձուլաշերեփ, կոճղակաղապար, ձուլամեքենա` օգտագործվող մետալուրգիայում",տոննա,66.3,1544.3,28.8,254.2
2020-2021,2020,2021,8455,Հաստոցներ գլանման եւ գլաններ դրանց համար,հատ,184.0,677.2,159.0,3157.4
2020-2021,2020,2021,8455,Հաստոցներ գլանման եւ գլաններ դրանց համար,տոննա,20.8,293.2,35.3,347.1
2020-2021,2020,2021,8456,Հաստոց նյութի մշակման` լազերային կամ այլ լուսա- կամ ֆոտո- ճառագայթի եւ այլ պրոցեսների օգնությամբ նյութի հեռացման եղանակով,հատ,176.0,1498.2,298.0,869.2
2020-2021,2020,2021,8457,"Կենտրոններ մշակող, հաստոց ագրեգատային միա-, բազմա- դիրքանի` մետաղի մշակման",հատ,4.0,287.4,6.0,121.5
2020-2021,2020,2021,8458,Հաստոց խառատային մետաղակտրիչ,հատ,51.0,410.2,85.0,498.0
2020-2021,2020,2021,8459,"Հաստոց մետաղահատ` գայլիկոնման, ներտաշման, ֆրեզերման, կտրման համար",հատ,3662.0,347.9,349.0,415.1
2020-2021,2020,2021,8460,"Հաստոց քերթիչ-հղկիչ, սրող, հոնինգման եւ մետաղի, մետաղակերամիկայի մշակման այլ գործողությունների",հազ.հատ,2.0,672.9,1.1,211.7
2020-2021,2020,2021,8461,"Հաստոց ռանդման, թործային, միջաձիգ, ատամնամշակման, սղոցող եւ այլ` մետաղի, մետաղակերամիկայի մշակման",հազ.հատ,2.2,200.4,3.3,292.6
2020-2021,2020,2021,8462,"Հաստոց մետաղի մշակման` դրոշմումով, կռումով; կորացման, կտրող, փորիչ; մամլիչ մետաղի մշակման",հազ.հատ,7.8,2747.7,3.8,1606.7
2020-2021,2020,2021,8463,Հաստոց այլ` մետաղի կամ մետաղակերամիկայի մշակման` ոչ նյութի հեռացմամբ,հատ,2523.0,508.5,62.0,224.3
2020-2021,2020,2021,8464,"Հաստոց քարի, կերամիկայի, բետոնի, ասբոցեմենտի կամ նման նյութերի կամ ապակու սառը մշակման",հատ,417.0,2837.3,733.0,2225.8
2020-2021,2020,2021,8465,"Հաստոց փայտի, խցանի, ոսկորի, էբոնիտի, պինդ պլաստմասսայի կամ նման պինդ նյութերի մշակման",հազ.հատ,12.0,2794.6,2.4,2150.4
2020-2021,2020,2021,8466,"Մասեր, 8456-8465 դիրքերի սարքավորման համար",տոննա,16.7,272.2,38.4,533.8
2020-2021,2020,2021,8467,"Գործիքներ ձեռքի օդաճնշման, հիդրավլիկ կամ ներկառուցված շարժիչով",հազ.հատ,249.9,6012.7,243.0,6556.6
2020-2021,2020,2021,8467,"Գործիքներ ձեռքի օդաճնշման, հիդրավլիկ կամ ներկառուցված շարժիչով",տոննա,108.6,550.6,118.6,522.0
2020-2021,2020,2021,8468,"Սարքավորում զոդման, հատման` ոչ 8515 դիրքում նշած; ապարատ` մակերեսային ջերմամշակման, գազով աշխատող",կգ,251.8,5.9,21848.4,12.1
2020-2021,2020,2021,8468,"Սարքավորում զոդման, հատման` ոչ 8515 դիրքում նշած; ապարատ` մակերեսային ջերմամշակման, գազով աշխատող",հազ.հատ,11.3,69.0,9.3,221.1
2020-2021,2020,2021,8470,"Հաշվիչ; հաշվապահական, փոստային դրոշմանշիչ, տոմսային եւ այլ նման մեքենա հաշվիչ սարքով; դրամարկղային ապարատ",հազ.հատ,120.8,3816.0,108.4,3122.4
2020-2021,2020,2021,8471,Համակարգիչներ եւ դրանց բլոկներ,հազ.հատ,334.9,44951.8,376.2,57690.4
2020-2021,2020,2021,8472,Սարքավորում գրասենյակային այլ,հազ.հատ,62.9,3151.8,28.9,1286.7
2020-2021,2020,2021,8473,"Մասեր եւ պարագաներ, 8469-8472 դիրքերի մեքենաների համար",տոննա,121.9,2476.3,148.4,2709.4
2020-2021,2020,2021,8474,"Սարք բնահող, հանքաքար, այլ պինդ հանքանյութ լվալու, աղալու, խառնելու; պինդ հանքավառելանյութ, կերամիկ բաղադրություն, ցեմենտ, գիպսանյութ ագլոմերացնելու, կաղապարելու, ձուլելու",հազ.հատ,15.5,20177.7,48.6,18100.1
2020-2021,2020,2021,8474,"Սարք բնահող, հանքաքար, այլ պինդ հանքանյութ լվալու, աղալու, խառնելու; պինդ հանքավառելանյութ, կերամիկ բաղադրություն, ցեմենտ, գիպսանյութ ագլոմերացնելու, կաղապարելու, ձուլելու",տոննա,2952.5,10223.0,2718.5,9699.9
2020-2021,2020,2021,8475,"Մեքենաներ լամպի, փողակի կամ ապակե անոթում գազապարպվող լամպի հավաքման; ապակի կամ ապակե իրեր պատրաստելու կամ ջերմամշակման",հատ,3.0,422.2,1.0,3.4
2020-2021,2020,2021,8475,"Մեքենաներ լամպի, փողակի կամ ապակե անոթում գազապարպվող լամպի հավաքման; ապակի կամ ապակե իրեր պատրաստելու կամ ջերմամշակման",տոննա,9.3,319.9,3.7,97.1
2020-2021,2020,2021,8476,"Ավտոմատ առեւտրային, թղթադրամ եւ մետաղադրամ մանրելու",հազ.հատ,1.1,893.9,1.5,1026.3
2020-2021,2020,2021,8476,"Ավտոմատ առեւտրային, թղթադրամ եւ մետաղադրամ մանրելու",տոննա,1.5,47.2,1.9,86.0
2020-2021,2020,2021,8477,Սարքավորում ռետինի կամ պլաստմասսայի մշակման կամ այս նյութերից ապրանք արտադրելու,հազ.հատ,13.7,5853.1,21.6,3445.3
2020-2021,2020,2021,8477,Սարքավորում ռետինի կամ պլաստմասսայի մշակման կամ այս նյութերից ապրանք արտադրելու,տոննա,23.8,481.2,27.2,298.2
2020-2021,2020,2021,8478,Սարքավորում թութունի պատրաստման,հատ,253.0,16120.6,2553.0,4740.3
2020-2021,2020,2021,8478,Սարքավորում թութունի պատրաստման,տոննա,3.2,630.7,1.1,259.6
2020-2021,2020,2021,8479,"Մեքենաներ եւ մեխանիկական սարքեր` անհատական ֆունկցիաներ ունեցող, տվյալ խմբում այլ տեղում չնշած",հազ.հատ,33.8,13450.0,150.1,17221.3
2020-2021,2020,2021,8479,"Մեքենաներ եւ մեխանիկական սարքեր` անհատական ֆունկցիաներ ունեցող, տվյալ խմբում այլ տեղում չնշած",տոննա,38.2,617.4,24.0,542.0
2020-2021,2020,2021,8480,"Ձուլման տակդիր; ձուլամոդել; կաղապար մետաղի, ապակու, հանքանյութի, ռետինի կամ պլաստմասսայի ձուլման",տոննա,192.6,2754.1,209.5,2790.7
2020-2021,2020,2021,8481,"Ծորակ, կափույր եւ նման ամրան խողովակատարի, կաթսայի, ջրամբարի  կամ նման տարողության համար",տոննա,1795.7,16416.3,1770.3,18445.3
2020-2021,2020,2021,8482,Առանցքակալներ գնդիկավոր կամ հոլովակավոր,հազ.հատ,443.0,2404.6,357.0,2678.6
2020-2021,2020,2021,8482,Առանցքակալներ գնդիկավոր կամ հոլովակավոր,տոննա,18.6,153.5,11.2,129.5
2020-2021,2020,2021,8483,"Լիսեռ; առանցքակալ; ատամնավոր, փոխանցման տուփ; թափանիվ, փոկանիվ; օղագոտի",հազ.հատ,190.2,5351.3,271.9,5535.3
2020-2021,2020,2021,8483,"Լիսեռ; առանցքակալ; ատամնավոր, փոխանցման տուփ; թափանիվ, փոկանիվ; օղագոտի",տոննա,247.7,3268.7,143.9,2058.4
2020-2021,2020,2021,8484,Միջադիր եւ նման խտվածք թերթավոր մետաղից այլ նյութի հետ համակցված; մեխանիկական խտարար,հազ.հատ,144.4,416.2,167.7,1019.9
2020-2021,2020,2021,8484,Միջադիր եւ նման խտվածք թերթավոր մետաղից այլ նյութի հետ համակցված; մեխանիկական խտարար,տոննա,28.8,762.3,38.9,1244.5
2020-2021,2020,2021,8486,"Մեքենա եւ ապարատուրա` կիսահաղորդիչ բուլ, հարթակ, այլ կիսահաղորդիչ սարքեր արտադրելու, մասեր",կգ,309.0,0.2,904.4,8.0
2020-2021,2020,2021,8486,"Մեքենա եւ ապարատուրա` կիսահաղորդիչ բուլ, հարթակ, այլ կիսահաղորդիչ սարքեր արտադրելու, մասեր",հատ,7.0,103.3,3.0,5.8
2020-2021,2020,2021,8487,"Սարքավորման մասեր, որոնք չունեն էլեկտրական միացություն, մեկուսիչ, կոճ, հաղորդալար եւ այլ նման դետալներ",հատ,89.0,31.6,640.0,23.6
2020-2021,2020,2021,8487,"Սարքավորման մասեր, որոնք չունեն էլեկտրական միացություն, մեկուսիչ, կոճ, հաղորդալար եւ այլ նման դետալներ",տոննա,45.0,251.6,335.0,702.5
2020-2021,2020,2021,8501,Շարժիչ եւ գեներատոր էլեկտրական,հազ.հատ,89.7,8215.6,66.1,2807.9
2020-2021,2020,2021,8502,Էլեկտրագեներատորային կայանք եւ էլեկտրական փոխարկիչ,հազ.հատ,38.9,10789.0,14.8,5194.6
2020-2021,2020,2021,8503,"Մասեր, 8501 կամ 8502 դիրքերի մեքենաների",տոննա,393.8,5519.8,142.4,2284.7
2020-2021,2020,2021,8504,"Հոսանքափոխարկիչ էլեկտրական, կոճ ինդուկտիվության եւ դրոսել",հազ.հատ,713.8,22152.2,1081.9,35876.4
2020-2021,2020,2021,8504,"Հոսանքափոխարկիչ էլեկտրական, կոճ ինդուկտիվության եւ դրոսել",տոննա,12.6,295.8,16.2,313.1
2020-2021,2020,2021,8505,Էլեկտրամագնիս; հաստատուն մագնիս եւ մագնիսացվող արտադրանք,տոննա,201.0,330.9,43.5,456.9
2020-2021,2020,2021,8506,"Սկզբնական տարրեր, մարտկոցներ",կգ,0.0,0.0,0.3,2.0
2020-2021,2020,2021,8506,"Սկզբնական տարրեր, մարտկոցներ",հազ.հատ,15872.9,1350.3,14962.4,1606.3
2020-2021,2020,2021,8507,"Կուտակիչներ էլեկտրական, ներառյալ զտիչներ դրանց համար",հազ.հատ,470.7,9293.5,553.7,13472.5
2020-2021,2020,2021,8507,"Կուտակիչներ էլեկտրական, ներառյալ զտիչներ դրանց համար",տոննա,26.8,107.7,20.5,109.0
2020-2021,2020,2021,8508,Փոշեծծիչներ,հազ.հատ,70.7,4061.0,85.4,5798.5
2020-2021,2020,2021,8508,Փոշեծծիչներ,տոննա,1.3,12.8,13.1,23.2
2020-2021,2020,2021,8509,Էլեկտրատեխնիկական կենցաղային սարքեր,հազ.հատ,307.1,4592.1,311.9,5729.3
2020-2021,2020,2021,8509,Էլեկտրատեխնիկական կենցաղային սարքեր,տոննա,1.9,32.6,2.1,55.7
2020-2021,2020,2021,8510,"Էլեկտրաածելի, մեքենա մազ կտրելու",կգ,2142.6,14.8,282.0,51.4
2020-2021,2020,2021,8510,"Էլեկտրաածելի, մեքենա մազ կտրելու",հազ.հատ,101.1,1222.4,143.6,1730.0
2020-2021,2020,2021,8511,Էլեկտրասարքավորում ներքին այրման շարժիչի վառման կամ գործարկման,հազ.հատ,698.2,2008.7,893.4,2460.2
2020-2021,2020,2021,8511,Էլեկտրասարքավորում ներքին այրման շարժիչի վառման կամ գործարկման,տոննա,90.3,372.8,216.4,699.8
2020-2021,2020,2021,8512,"Սարքավորում Էլեկտրալուսավորման կամ ազդանշանային, ապակեմաքրիչ, հակա -սառցապատիչ, -քրտնապատիչ",հազ.հատ,132.4,1470.5,224.1,2511.4
2020-2021,2020,2021,8512,"Սարքավորում Էլեկտրալուսավորման կամ ազդանշանային, ապակեմաքրիչ, հակա -սառցապատիչ, -քրտնապատիչ",տոննա,66.0,434.2,126.7,711.3
2020-2021,2020,2021,8513,Լապտեր դյուրակիր էլեկտրական,կգ,5.0,0.3,2.0,0.1
2020-2021,2020,2021,8513,Լապտեր դյուրակիր էլեկտրական,հազ.հատ,147.4,192.9,251.1,208.5
2020-2021,2020,2021,8514,Վառարան եւ խուց արդյունաբերական կամ լաբորատոր էլեկտրական,հազ.հատ,3.2,2136.6,3.1,2179.9
2020-2021,2020,2021,8514,Վառարան եւ խուց արդյունաբերական կամ լաբորատոր էլեկտրական,տոննա,146.1,1582.1,10.1,157.5
2020-2021,2020,2021,8515,"Ապարատ զոդման` էլեկտրական, լազերային եւ այլ գործողություններիի միջոցով",հազ.հատ,323.7,1946.7,101.4,2106.7
2020-2021,2020,2021,8515,"Ապարատ զոդման` էլեկտրական, լազերային եւ այլ գործողություններիի միջոցով",տոննա,13.2,182.4,9.8,89.5
2020-2021,2020,2021,8516,Էլեկտրական ջեռուցիչ; էլեկտրասարք տարածքի եւ բնահողի տաքացման; այլ կենցաղային էլեկտրատաքացնող սարքեր,հազ.հատ,1509.3,16647.0,1995.2,20407.7
2020-2021,2020,2021,8516,Էլեկտրական ջեռուցիչ; էլեկտրասարք տարածքի եւ բնահողի տաքացման; այլ կենցաղային էլեկտրատաքացնող սարքեր,տոննա,8.5,63.9,3.2,39.8
2020-2021,2020,2021,8517,"Հեռախոսային ապարատ բջջային ցանցի կամ այլ կապի; այլ սարք ձայնի, պատկերի կամ այլ տվյալի ընդունման կամ հաղորդման",հազ.հատ,1064.4,104134.3,1041.9,83079.2
2020-2021,2020,2021,8518,"Խոսափող; բարձրախոս; ընկալուչ, հեռախոս գլխամասի; էլեկտրաուժեղարար ձայնի հաճախականության",կգ,440.6,10.1,485.1,24.1
2020-2021,2020,2021,8518,"Խոսափող; բարձրախոս; ընկալուչ, հեռախոս գլխամասի; էլեկտրաուժեղարար ձայնի հաճախականության",հազ.հատ,397.9,4046.2,468.2,8460.7
2020-2021,2020,2021,8519,Սարքավորում ձայնա -գրող կամ -վերարտադրող,հազ.հատ,44.0,329.9,35.6,437.0
2020-2021,2020,2021,8521,Ապարատուրա տեսա -գրող կամ -վերարտադրող,հազ.հատ,16.7,880.3,18.4,1407.5
2020-2021,2020,2021,8522,Մասեր եւ պարագաներ 8519-8521 դիրքերի ապարատուրայի համար,կգ,178.3,6.7,335.2,12.9
2020-2021,2020,2021,8523,"Սկավառակ, ""ինտելեկտուալ քարտ"" եւ  այլ կրիչներ ձայնի կամ այլ երեւույթի գրառման, բացի 37 խմբի արտադրանքից",հազ.հատ,3421.0,5436.2,3316.0,2354.0
2020-2021,2020,2021,8525,"Հաղորդող ապարատուրա ռադիո կամ հեռուստահաղորդումների; հեռուստատեսային, թվային խցիկներ եւ ձայնագրող տեսախցիկներ",հազ.հատ,90.4,4826.2,126.2,6379.3
2020-2021,2020,2021,8526,"Ապարատուրա ռադիո -լոկացիոն, -նավագնացային եւ ռադիոապարատուրա հեռաղեկավարման",հազ.հատ,12.7,5239.3,28.7,2115.0
2020-2021,2020,2021,8527,Ընդունող ապարատուրա ռադիոհեռարձակման,հազ.հատ,26.0,898.3,22.7,535.2
2020-2021,2020,2021,8528,Մոնիտոր եւ պրոեյկտոր; ընդունիչ սարքավորում հեռուստատեսային կապի,հազ.հատ,137.0,20630.4,155.0,29059.2
2020-2021,2020,2021,8529,Մասեր եւ պարագաներ 8525-8528 դիրքերի ապարատուրայի համար,հատ,1331.0,66.1,228.0,40.4
2020-2021,2020,2021,8529,Մասեր եւ պարագաներ 8525-8528 դիրքերի ապարատուրայի համար,տոննա,25.8,516.7,47.5,1044.6
2020-2021,2020,2021,8530,Էլեկտրասարք ազդանշանային` ապահովող շարժման անվտանգությունը փոխադրամիջոցների (ոչ 8608 դիրքում նշած),հատ,32.0,7.4,397.0,63.9
2020-2021,2020,2021,8530,Էլեկտրասարք ազդանշանային` ապահովող շարժման անվտանգությունը փոխադրամիջոցների (ոչ 8608 դիրքում նշած),տոննա,8.9,38.3,4.3,53.6
2020-2021,2020,2021,8531,"Էլեկտրասարքեր ձայնային կամ տեսողական ազդանշանային (ոչ 8512, 8530 դիրքերում նշած)",հազ.հատ,107.0,1321.5,243.5,3696.4
2020-2021,2020,2021,8531,"Էլեկտրասարքեր ձայնային կամ տեսողական ազդանշանային (ոչ 8512, 8530 դիրքերում նշած)",տոննա,5.6,182.8,24.3,434.6
2020-2021,2020,2021,8532,Էլեկտրական կոնդենսատոր; մասեր,տոննա,8.0,213.1,5.2,89.1
2020-2021,2020,2021,8533,Դիմադրություն էլեկտրական,տոննա,4.7,193.2,3.5,133.3
2020-2021,2020,2021,8534,Տպասխեմաներ,տոննա,2.3,198.2,2.5,323.6
2020-2021,2020,2021,8535,Ապարատուրա Էլեկտրական` կոմուտացիայի կամ  շղթայի պաշտպանության  >1000 Վ լարման դեպքում,տոննա,654.4,7803.7,238.2,1890.0
2020-2021,2020,2021,8536,"Ապարատուրա Էլեկտրական` կոմուտացիայի կամ  շղթայի պաշտպանության  <= 1000 Վ լարման դեպքում; միացուցիչ օպտիկ. մանրաթելի, քուղերի կամ կաբելի համար",տոննա,2340.5,8850.0,1586.0,10947.0
2020-2021,2020,2021,8537,"Պուլտ, բարձակ, սեղան, բաշխիչ վահան եւ այլ հիմք էլեկտրական ապարատի համար",տոննա,357.7,15072.4,184.9,11835.8
2020-2021,2020,2021,8538,"Մասեր 8535, 8536 կամ 8537 դիրքերի ապարատուրայի համար",տոննա,182.5,1919.2,285.3,1717.1
2020-2021,2020,2021,8539,"Լամպեր շիկացման էլեկտրական կամ գազապարպման, ուլտրամանուշակագույն կամ ինֆրակարմիր; աղեղային",կգ,1128.0,25.9,468.1,8.1
2020-2021,2020,2021,8539,"Լամպեր շիկացման էլեկտրական կամ գազապարպման, ուլտրամանուշակագույն կամ ինֆրակարմիր; աղեղային",հազ.հատ,11596.5,4786.3,9668.3,5284.9
2020-2021,2020,2021,8540,"Լամպ եւ փողակ ջերմա- , սառը կամ ֆոտո- կատոդով",կգ,0.8,0.0,0.0,0.0
2020-2021,2020,2021,8540,"Լամպ եւ փողակ ջերմա- , սառը կամ ֆոտո- կատոդով",հատ,20044.0,141.5,83.0,36.4
2020-2021,2020,2021,8541,"Դիոդ, տրանզիստոր եւ նման կիսահաղորդիչ սարք; լուսազգայուն կիսահաղորդիչ սարք; պյեզոէլեկտրական բյուրեղ",կգ,92.8,3.2,8.0,3.0
2020-2021,2020,2021,8541,"Դիոդ, տրանզիստոր եւ նման կիսահաղորդիչ սարք; լուսազգայուն կիսահաղորդիչ սարք; պյեզոէլեկտրական բյուրեղ",հազ.հատ,2168.0,30502.8,2724.2,68917.9
2020-2021,2020,2021,8542,Սխեմաներ էլեկտրոնային ինտեգրալ,կգ,0.9,0.1,6.0,7.2
2020-2021,2020,2021,8542,Սխեմաներ էլեկտրոնային ինտեգրալ,հազ.հատ,162.6,1343.1,275.1,931.9
2020-2021,2020,2021,8543,"Մեքենա էլեկտրական եւ ապարատուրա, անհատական ֆունկցիաներ ունեցող",կգ,750.5,31.9,4176.4,234.1
2020-2021,2020,2021,8543,"Մեքենա էլեկտրական եւ ապարատուրա, անհատական ֆունկցիաներ ունեցող",հազ.հատ,257.1,3679.0,1571.3,13562.5
2020-2021,2020,2021,8544,"Հաղորդալար մեկուսացված, կաբել եւ այլ մեկուսացված էլեկտրական հաղորդիչ; կաբել թելքաօպտիկ",տոննա,6537.0,21219.7,4287.4,21838.0
2020-2021,2020,2021,8545,"Ածխային Էլեկտրոդ, խոզանակ, ածուխ լամպի, մարտկոցի եւ այլ արտադրանք ածխածնից",տոննա,329.0,762.5,354.0,1383.2
2020-2021,2020,2021,8546,Մեկուսիչներ էլեկտրական` ցանկացած նյութերից,տոննա,558.1,1747.9,1039.2,1149.3
2020-2021,2020,2021,8547,Ամրան մեկուսիչ` էլեկտրական սարքավորման` մեկուսիչ նյութերից; մեկուսիչ կցամասեր,տոննա,25.9,184.7,128.7,297.8
2020-2021,2020,2021,8548,"Թափոն եւ ջարդոն սկզբնկան տարրերի, մարտկոցի եւ Էլեկտրական կուտակիչի",կգ,27.9,4.5,260.9,9.4
2020-2021,2020,2021,8548,"Թափոն եւ ջարդոն սկզբնկան տարրերի, մարտկոցի եւ Էլեկտրական կուտակիչի",հատ,0.0,0.0,4.0,0.7
2020-2021,2020,2021,8601,"Երկաթուղային լոկոմոտիվ, աշխատող էլեկտրաէներգիայի արտաքին աղբյուրից կամ կուտակիչային",հատ,2.0,187.6,0.0,0.0
2020-2021,2020,2021,8603,"Շարժիչով երկաթուղային կամ տրամվայի վագոն, բաց կառամատույց",հատ,0.0,0.0,2.0,2866.0
2020-2021,2020,2021,8604,"Փոխադրամիջոց` երկաթուղային, տրամվայի գծերի նորոգման կամ տեխնիկական սպասարկման",հատ,2.0,0.6,0.0,0.0
2020-2021,2020,2021,8605,"Վագոններ երկաթուղային, տրամվայի ուղեւորային եւ այլ հատուկ նշանակության",հատ,1.0,1.1,31.0,20496.1
