period_label,year_from,year_to,product_code,product_name,unit,quantity_from,value_from,quantity_to,value_to
I կիսամյակ 2021-2022,2021,2022,3304,Գեղարարային միջոցներ,տոննա,561.0,6627.4,437.7,9326.5
I կիսամյակ 2021-2022,2021,2022,3305,Միջոցներ մազերի համար,տոննա,2204.1,8818.4,1980.7,7859.6
I կիսամյակ 2021-2022,2021,2022,3306,Միջոցներ բերանի խոռոչի հիգիենայի եւ ատամների,տոննա,339.6,2158.6,316.6,2035.8
I կիսամյակ 2021-2022,2021,2022,3307,"Միջոցներ` սափրվելու, լոգանքի, մազի հեռացման; հոտազերծիչ",տոննա,796.0,4358.7,971.3,4176.9
I կիսամյակ 2021-2022,2021,2022,3401,Օճառ,տոննա,1987.0,4039.2,5313.8,4310.1
I կիսամյակ 2021-2022,2021,2022,3402,Լվացող  եւ մաքրող միջոցներ,տոննա,11031.1,11755.0,11018.7,12431.1
I կիսամյակ 2021-2022,2021,2022,3403,"Քսանյութեր եւ միջոցներ մանածագործ նյութի, կաշու, մորթու ճարպամշակման համար",տոննա,291.5,1311.2,304.9,1336.5
I կիսամյակ 2021-2022,2021,2022,3404,Մոմեր արհեստական եւ պատրաստի մոմեր,տոննա,6.7,36.1,21.2,135.0
I կիսամյակ 2021-2022,2021,2022,3405,"Քսուք կոշիկի, փայլեցուցիչ եւ մածուկ կահույքի, հատակի, տրանսպորտային միջոցի եւ այլնի",տոննա,183.7,476.8,225.8,774.2
I կիսամյակ 2021-2022,2021,2022,3406,"Մոմեր, բարակ պարաֆինային մոմեր եւ նման արտադրանք",տոննա,50.5,143.2,50.7,173.0
I կիսամյակ 2021-2022,2021,2022,3407,Ծեփիչ մածուկ; ատամնաբուժուական բաղադրություն,տոննա,80.5,393.2,81.0,586.2
I կիսամյակ 2021-2022,2021,2022,3501,Կազեին; կազեինային սոսինձներ,տոննա,1.5,5.6,2.0,22.2
I կիսամյակ 2021-2022,2021,2022,3502,"Ալբումիններ, ալբումինատներ եւ ալբումինի այլ ածանցյալներ",կգ,20103.3,48.0,90.0,19.9
I կիսամյակ 2021-2022,2021,2022,3503,"Ժելատին, ձկնասոսինձ; կենդանական ծագման սոսինձ այլ, ոչ 3501 դիրքի կազեիններ",տոննա,18.5,100.5,15.7,94.1
I կիսամյակ 2021-2022,2021,2022,3504,Պեպտոններ; սպիտակուցային այլ նյութեր եւ դրանց ածանցյաներ; կաշվից փոշի,տոննա,305.1,1010.1,511.5,1691.6
I կիսամյակ 2021-2022,2021,2022,3505,Դեքստրին եւ այլ ձեւափոխված օսլա; սոսինձ` օսլայի կամ դեքստրինի հիմքի վրա,տոննա,136.3,238.8,141.7,297.2
I կիսամյակ 2021-2022,2021,2022,3506,Պատրաստի սոսինձ եւ ալգեզիվ` բաժնեծրարած,տոննա,653.9,2148.5,1071.8,3664.9
I կիսամյակ 2021-2022,2021,2022,3507,Մակարդներ,տոննա,29.4,325.4,60.4,438.5
I կիսամյակ 2021-2022,2021,2022,3602,"Պայթուցիկ պատրաստի նյութեր, բացի վառոդը",տոննա,277.4,297.4,78.7,171.7
I կիսամյակ 2021-2022,2021,2022,3603,"Քուղեր` բիքֆորդյան, ճայթեցնող; հրապատիճ; բռնկիչ; էլեկտրաճայթիչ",կմ,2496.8,247.6,3829.0,435.4
I կիսամյակ 2021-2022,2021,2022,3603,"Քուղեր` բիքֆորդյան, ճայթեցնող; հրապատիճ; բռնկիչ; էլեկտրաճայթիչ",հազ.հատ,396.1,321.8,1726.0,282.6
I կիսամյակ 2021-2022,2021,2022,3604,"Հրավառելիք, հրթիռ` ազդանշանային, անձրեւային, ազդանշան` հակամառախուղային, հրատեխնիկական իրեր",հազ.հատ,240.2,87.3,1846.0,165.0
I կիսամյակ 2021-2022,2021,2022,3605,Լուցկի,տոննա,128.3,183.5,147.8,193.2
I կիսամյակ 2021-2022,2021,2022,3606,Ֆերոցերիներ եւ այլ հրակիր համաձուլվածքներ; ապրանքներ դյուրավառ նյութերից,տոննա,5.8,14.1,18.3,43.4
I կիսամյակ 2021-2022,2021,2022,3701,"Լուսանկարչական թիթեղ եւ հարթ ժապավեն, զգայունացրած, չլուսակայած",հազ.քմ,79.0,375.4,34.4,329.4
I կիսամյակ 2021-2022,2021,2022,3701,"Լուսանկարչական թիթեղ եւ հարթ ժապավեն, զգայունացրած, չլուսակայած",հատ,650.0,4.6,601.0,2.9
I կիսամյակ 2021-2022,2021,2022,3702,"Լուսանկարչական ժապավեններ գլանափաթեթով, զգայունացրած, չլուսակայած",հատ,3.0,0.4,197.0,3.1
I կիսամյակ 2021-2022,2021,2022,3702,"Լուսանկարչական ժապավեններ գլանափաթեթով, զգայունացրած, չլուսակայած",մ,12.1,0.1,16548.3,15.6
I կիսամյակ 2021-2022,2021,2022,3702,"Լուսանկարչական ժապավեններ գլանափաթեթով, զգայունացրած, չլուսակայած",քմ,687.3,16.4,518.2,2.2
I կիսամյակ 2021-2022,2021,2022,3703,"Լուսանկարչական թուղթ, ստվարաթուղթ եւ մանածանյութ, զգայունացրած, չլուսակայած",տոննա,11.7,42.6,21.5,67.8
I կիսամյակ 2021-2022,2021,2022,3707,Ֆոտոքիմիկատ; արտադրանք լուսանկարչական նպատակի համար՝ փաթեթավորած մանրածախ առեւտրի համար,տոննա,121.8,196.0,213.9,291.1
I կիսամյակ 2021-2022,2021,2022,3801,Գրաֆիտ եւ ապրանքներ գրաֆիտի հիմքի վրա,կգ,26.0,1.3,5523.4,69.5
I կիսամյակ 2021-2022,2021,2022,3802,"Ակտիվացրած ածուխ, բնական հանքանյութեր; ածուխ կենդանական",տոննա,93.7,201.0,125.5,293.6
I կիսամյակ 2021-2022,2021,2022,3804,"Մոխրաջուր` փայտի թաղանթանյութի արտադրանքից, ոչ թալիումի յուղ",տոննա,8.0,3.7,17.0,9.8
I կիսամյակ 2021-2022,2021,2022,3805,Բեւեկնայուղ փայտանյութի եւ տերպենային այլ յուղ; սոճու յուղ,տոննա,34.2,113.6,36.1,68.6
I կիսամյակ 2021-2022,2021,2022,3806,Բեւեկնախեժ եւ խեժաթթուներ; սպիրտ եւ յուղ բեւեկնախեժի,կգ,1072.2,4.0,330.5,3.9
I կիսամյակ 2021-2022,2021,2022,3807,Փայտաձյութ; յուղեր` փայտաձյութից; կրեոզոտ փայտի; փայտի սպիրտ; բուսական կուպր,կգ,29.4,0.1,29.3,0.9
I կիսամյակ 2021-2022,2021,2022,3808,"Միջատասպան նյութ, ներաճը կանխող եւ բույսի աճը կարգավորող միջոց, ախտահանիչ",տոննա,1832.0,11815.6,1932.1,10118.9
I կիսամյակ 2021-2022,2021,2022,3809,"Հարդարման միջոց, ներկումն արագացնող եւ ներկանյութ սեւեռակող միջոց",տոննա,35.8,87.7,52.8,136.2
I կիսամյակ 2021-2022,2021,2022,3810,"Պատրաստուկ մետաղական մակերեսի խածատման, զոդման` հալանյութ",տոննա,1.9,11.1,3.7,16.4
I կիսամյակ 2021-2022,2021,2022,3811,"Հակա- ճայթիչ, օքսիդիչ, խեժագոյացման արգելակիչ, հակաքայքայիչ նյութ` նավթանյութի հանդեպ",տոննա,57.1,132.3,107.8,284.7
I կիսամյակ 2021-2022,2021,2022,3812,"Արագարար կաուչուկի ռետինացման; կայունարար կաուչուկի, պլաստմասսայի",տոննա,200.7,472.2,295.2,737.8
I կիսամյակ 2021-2022,2021,2022,3813,Կրակմարիչի լիցք; հրդեհի կրակմարման նռնակ,տոննա,5.5,24.1,20.0,9.3
I կիսամյակ 2021-2022,2021,2022,3814,Լուծիչներ; բաղադրություններ ներկերի եւ լաքերի հեռացման,տոննա,355.8,594.2,577.0,1057.3
I կիսամյակ 2021-2022,2021,2022,3815,"Ռեակցիաների ակտիվարար, արագարար եւ կատալիզատոր",տոննա,26.9,146.3,21.8,138.6
I կիսամյակ 2021-2022,2021,2022,3816,"Հրակայուն ցեմենտ, շաղախ շինարարական, բետոններ եւ նման բաղադրություններ",տոննա,379.7,366.0,615.8,669.3
I կիսամյակ 2021-2022,2021,2022,3817,Ալկիլբենզոլ խառը եւ ալկիլնավթալին խառը,կգ,155.0,0.3,100.0,1.5
I կիսամյակ 2021-2022,2021,2022,3818,Քիմիական տարրեր` էլեկտրոնիկայում օգտագործելու համար,կգ,74.0,0.1,5.2,1.1
I կիսամյակ 2021-2022,2021,2022,3819,Հեղուկներ հիդրավլիկ արգելակման` բիտումային հանքանյութերից,տոննա,212.6,310.6,314.7,585.0
I կիսամյակ 2021-2022,2021,2022,3820,Հակասառիչներ եւ հեղուկներ հակախամրիչ,տոննա,316.0,380.2,289.3,516.2
I կիսամյակ 2021-2022,2021,2022,3821,Մշակային միջավայրեր մանրէներ աճեցնելու համար,տոննա,2.1,154.8,2.5,258.0
I կիսամյակ 2021-2022,2021,2022,3822,Ազդանյութեր ախտորոշիչ կամ լաբորատոր տակդիրով,տոննա,48.2,5811.8,83.1,4274.5
I կիսամյակ 2021-2022,2021,2022,3823,Արդյունաբերական միակարբոն ճարպաթթու; թթվայուղ; ճարպոտ սպիրտ,տոննա,6.9,23.4,62.4,75.8
I կիսամյակ 2021-2022,2021,2022,3824,Կապակցանյութ ձուլակաղապարի եւ կաղապարարմատի արտադրության համար,տոննա,2440.7,2912.2,3722.5,4639.0
I կիսամյակ 2021-2022,2021,2022,3825,Մնացորդային մթերք քիմիական կամ կից ճյուղերի; թափոն քաղաքային տնտեսության; հոսող ջրերի շլամ; այլ թափոններ,կգ,222.0,0.7,18171.0,21.5
I կիսամյակ 2021-2022,2021,2022,3827,"Խառնուրդներ` էթանի,մեթանի կամ պրոպանի հալոգենացված ածանցյալներ պարունակող",տոննա,0.0,0.0,76.7,525.5
I կիսամյակ 2021-2022,2021,2022,3901,"Պոլիմերներ էթիլենի, սկզբնական ձեւերով",տոննա,4606.9,6171.9,6704.8,10889.0
I կիսամյակ 2021-2022,2021,2022,3902,"Պոլիմերներ պրոպիլենի կամ այլ օլեֆինների, սկզբնական ձեւերով",տոննա,2773.4,3793.3,4882.2,6764.4
I կիսամյակ 2021-2022,2021,2022,3903,"Պոլիմերներ ստիրոլի, սկզբնական ձեւերով",տոննա,681.5,1301.6,831.5,1891.8
I կիսամյակ 2021-2022,2021,2022,3904,"Պոլիմերներ վինիլքլորիդի կամ այլ հալոգենացված օլեֆինների, սկզբնական ձեւերով",տոննա,2955.9,3903.3,4081.5,7632.6
I կիսամյակ 2021-2022,2021,2022,3905,Պոլիմերներ վինիլացետատի; այլ վինիլային պոլիմերներ սկզբնական ձեւերով,տոննա,178.8,484.7,343.4,1054.1
I կիսամյակ 2021-2022,2021,2022,3906,"Պոլիմերներ ակրիլային, սկզբնական ձեւերով",տոննա,363.2,831.1,455.7,1311.9
I կիսամյակ 2021-2022,2021,2022,3907,"Պոլի- ացետալ, կարբոնատ, եթեր, խեժեր էպօքսիդային, ալկիդային, սկզբնական ձեւերով",տոննա,3381.7,3843.3,2832.7,5286.1
I կիսամյակ 2021-2022,2021,2022,3908,Պոլիամիդներ սկզբնական ձեւերով,տոննա,17.7,65.2,23.2,116.3
I կիսամյակ 2021-2022,2021,2022,3909,"Ամինախեժ,ֆենոլախեժ, պոլիուրեթաններ, սկզբնական ձեւերով",տոննա,162.0,401.2,194.1,700.6
I կիսամյակ 2021-2022,2021,2022,3910,Սիլիկոններ սկզբնական ձեւերով,տոննա,28.5,99.3,17.4,179.6
I կիսամյակ 2021-2022,2021,2022,3911,"Խեժեր նավթային, կումարոն-ինդենային, պոլի- տերպեն, սուլֆիդ, սուլֆոն, սկզբնական ձեւերով",տոննա,1.2,7.5,14.3,44.0
I կիսամյակ 2021-2022,2021,2022,3912,"Ցելյուլոզա, սկզբնական ձեւերով",տոննա,175.9,860.9,305.8,1610.7
I կիսամյակ 2021-2022,2021,2022,3913,"Պոլիմերներ բնական եւ պոլիմերներ բնական ձեւափոխված, սկզբնական ձեւերով",կգ,832.5,13.7,882.0,24.2
I կիսամյակ 2021-2022,2021,2022,3914,"Խեժեր իոնափոխանակված, սկզբնական ձեւերով",տոննա,1.6,6.1,8.2,38.5
I կիսամյակ 2021-2022,2021,2022,3915,"Թափոններ, կտորտանքներ եւ մնացուկներ, պլաստմասսայից",տոննա,354.3,102.8,59.9,32.6
I կիսամյակ 2021-2022,2021,2022,3916,"Միաթել, ձողիկ, կաղապարաձող եւ տրամատ պլաստմասսայից",տոննա,422.9,943.8,441.2,1008.7
I կիսամյակ 2021-2022,2021,2022,3917,"Խողովակ, փողակ, ճկախողովակ, կցամասեր պլաստմասսայից",տոննա,2319.1,6115.2,2805.5,9002.6
I կիսամյակ 2021-2022,2021,2022,3918,"Պլաստմասսայից ծածկույթներ` հատակի, պատերի կամ առաստաղների համար",հազ.քմ,65.6,338.6,164.7,1155.5
I կիսամյակ 2021-2022,2021,2022,3919,"Սալիկ, թերթ, թաղանթ, նրբաթիթեղ, ժապավեն, շերտեր, պլաստմասսայից",տոննա,378.4,1868.6,667.2,2945.1
I կիսամյակ 2021-2022,2021,2022,3920,"Սալիկ, թերթ կամ ժապավեն այլ, պլաստմասսայից, ոչ ծակոտկեն",տոննա,3091.7,7917.8,5644.4,13222.9
I կիսամյակ 2021-2022,2021,2022,3921,"Սալիկ, թերթ կամ ժապավեն պլաստմասսայից, այլ",տոննա,1000.5,3771.1,2222.3,5138.8
I կիսամյակ 2021-2022,2021,2022,3922,"Լոգարան, ցնցուղ եւ նման սան-տեխնիկական իրեր, պլաստմասսայից",տոննա,229.4,945.8,932.1,1787.9
I կիսամյակ 2021-2022,2021,2022,3923,"Իրեր ապրանքների փաթեթավորման եւ տեղափոխման, խցանման պլաստմասսայից",տոննա,4072.9,6536.0,6726.0,9201.8
I կիսամյակ 2021-2022,2021,2022,3924,"Պլաստմասսե ճաշի եւ խոհանոցային սպասք, արդուզարդի պարագաներ",տոննա,1012.3,3537.1,1069.4,3732.5
I կիսամյակ 2021-2022,2021,2022,3925,Շինարարական դետալներ պլաստմասսայից,տոննա,806.7,2007.2,531.2,2005.9
I կիսամյակ 2021-2022,2021,2022,3926,Պլաստմասսե այլ իրեր եւ իրեր 3901-3914 դիրքերի այլ նյութերից,տոննա,1582.7,6683.7,2360.0,8465.9
I կիսամյակ 2021-2022,2021,2022,4001,"Բնական կաուչուկ, բալատա, գուտապերչ, գվայուլա, չիկլ",տոննա,383.5,761.4,189.2,402.3
I կիսամյակ 2021-2022,2021,2022,4002,"Կաուչուկ սինթետիկ եւ ֆակտիս, ստացված յուղերից",տոննա,61.7,140.5,140.7,327.7
I կիսամյակ 2021-2022,2021,2022,4003,Կաուչուկ վերականգնված,տոննա,8.0,14.8,1.4,8.9
I կիսամյակ 2021-2022,2021,2022,4004,"Թափոն, կտորտանք եւ մնացուկ ռետինից (ոչ կոշտ)",տոննա,150.1,85.4,33.1,14.9
I կիսամյակ 2021-2022,2021,2022,4005,Չվուլկանացված ռետինային խառնուրդ,տոննա,66.1,75.7,52.7,89.9
I կիսամյակ 2021-2022,2021,2022,4006,Այլ ձեւեր եւ արտադրանք չվուլկանացված ռետինից,տոննա,15.2,29.0,2.7,13.5
I կիսամյակ 2021-2022,2021,2022,4007,Վուլկանացված ռետինե թել եւ կորդ,տոննա,2.5,16.7,2.7,16.9
I կիսամյակ 2021-2022,2021,2022,4008,"Սալիկ, թերթ կամ ժապավեն վուլկանացված ռետինից, ոչ կոշտ",տոննա,197.6,473.6,192.0,748.6
I կիսամյակ 2021-2022,2021,2022,4008,"Սալիկ, թերթ կամ ժապավեն վուլկանացված ռետինից, ոչ կոշտ",քմ,40.6,4.3,1544.8,5.5
I կիսամյակ 2021-2022,2021,2022,4009,"Խողովակ, ճկափող, ճկախողովակ վուլկանացված ռետինից, ոչ կոշտ",տոննա,218.6,967.9,1091.1,2056.4
I կիսամյակ 2021-2022,2021,2022,4010,"Փոխակրիչ ժապավեններ եւ շարժափոկեր կամ բելթինգ, վուլկանացված ռետինից",տոննա,188.5,936.4,2087.0,1310.8
I կիսամյակ 2021-2022,2021,2022,4011,"Օդաճնշական ռետինե անվադողեր, նոր",հազ.հատ,361.1,14736.2,278.4,22188.5
I կիսամյակ 2021-2022,2021,2022,4012,"Օդաճնշական ռետինե անվադողեր, օգտագործած",հազ.հատ,2.5,54.6,7.2,150.3
I կիսամյակ 2021-2022,2021,2022,4013,Ռետինե օդախցիկ,հազ.հատ,131.7,168.2,58.5,181.5
I կիսամյակ 2021-2022,2021,2022,4014,"Իրեր հիգիենիկ կամ դեղագործական վուլկանացված ռետինից, ոչ կոշտ",տոննա,34.8,1239.4,36.3,1095.5
I կիսամյակ 2021-2022,2021,2022,4015,"Հագուստներ եւ դրա պարագաներ վուլկանացված ռետինից, ոչ կոշտ",հազ.զույգ,14051.6,1959.6,26922.8,2178.8
I կիսամյակ 2021-2022,2021,2022,4015,"Հագուստներ եւ դրա պարագաներ վուլկանացված ռետինից, ոչ կոշտ",տոննա,4.7,37.9,8.5,74.8
I կիսամյակ 2021-2022,2021,2022,4016,"Այլ իրեր վուլկանացված ռետինից, բացի կոշտ ռետինից",տոննա,787.2,4717.3,891.2,6812.9
I կիսամյակ 2021-2022,2021,2022,4017,"Կոշտ ռետին, ներառյալ թափոն; իրեր կոշտ ռետինից",կգ,98.9,3.7,6341.1,20.6
I կիսամյակ 2021-2022,2021,2022,4103,Այլ անմշակ մորթիներ,հազ.հատ,0.0,0.0,58.7,81.2
I կիսամյակ 2021-2022,2021,2022,4104,"Դաբաղած կաշի, կաշեթաղանթ խոշոր եղջրավոր անասունների",հատ,17.0,8.2,9.0,5.8
I կիսամյակ 2021-2022,2021,2022,4105,"Դաբաղած կաշի, կաշեթաղանթ ոչխարի մորթուց կամ գառան մորթիկից",հատ,32.0,0.0,0.0,0.0
I կիսամյակ 2021-2022,2021,2022,4106,"Դաբաղած կաշի, կաշեթաղանթ այլ կենդանիների մորթուց",հատ,528.0,15.6,1106.0,40.9
I կիսամյակ 2021-2022,2021,2022,4107,Կաշի` լրացուցիչ մշակած դաբաղումից հետո  խոշոր եղջրավոր անասունների մորթուց,կգ,584.0,2.2,1058.0,4.0
I կիսամյակ 2021-2022,2021,2022,4107,Կաշի` լրացուցիչ մշակած դաբաղումից հետո  խոշոր եղջրավոր անասունների մորթուց,հազ.քմ,143.1,1346.2,153.7,1650.9
I կիսամյակ 2021-2022,2021,2022,4112,Կաշի` լրացուցիչ մշակած դաբաղումից հետո ոչխարի կամ գառան,կգ,6990.4,56.4,702.5,9.5
I կիսամյակ 2021-2022,2021,2022,4113,Կաշի` լրացուցիչ մշակած դաբաղումից հետո այլ կենդանիների մորթուց,հազ.քմ,23.8,158.6,18.3,138.9
I կիսամյակ 2021-2022,2021,2022,4114,Թավշակաշի; կաշի լաքապատ; կաշի մետաղացված,հազ.հատ,5.5,27.8,7.1,40.0
I կիսամյակ 2021-2022,2021,2022,4114,Թավշակաշի; կաշի լաքապատ; կաշի մետաղացված,քմ,69.0,2.5,177.7,28.4
I կիսամյակ 2021-2022,2021,2022,4115,"Համակցված կաշի, թափոն բնական կամ համակցված կաշվից; կաշվից փոշի եւ ալյուր",կգ,6.6,0.2,26.5,0.8
I կիսամյակ 2021-2022,2021,2022,4201,Ապրանքներ փոկա-թամբագործ. եւ լծասարքեր ցանկացած կենդանիների համար,տոննա,6.4,50.1,4.2,72.5
I կիսամյակ 2021-2022,2021,2022,4202,"Ուղեպայուսակ, ճամպրուկ, դրամապանակ, ակնոցի, հեռադիտակի եւ այլ պայուսկաներ, տուփեր",հազ.հատ,1110.7,4353.0,1464.8,5433.9
I կիսամյակ 2021-2022,2021,2022,4202,"Ուղեպայուսակ, ճամպրուկ, դրամապանակ, ակնոցի, հեռադիտակի եւ այլ պայուսկաներ, տուփեր",տոննա,42.2,637.0,38.3,902.7
I կիսամյակ 2021-2022,2021,2022,4203,Հագուստ եւ հագուստի պարագաներ բնական կամ համակցված կաշվից,հազ.զույգ,15.2,42.5,20.1,73.3
I կիսամյակ 2021-2022,2021,2022,4203,Հագուստ եւ հագուստի պարագաներ բնական կամ համակցված կաշվից,հազ.հատ,3.0,396.8,7.5,964.9
I կիսամյակ 2021-2022,2021,2022,4203,Հագուստ եւ հագուստի պարագաներ բնական կամ համակցված կաշվից,տոննա,11.9,289.2,20.0,421.4
I կիսամյակ 2021-2022,2021,2022,4205,Այլ իրեր բնական կամ արհեստական կաշվից,տոննա,3.5,37.7,3.6,28.1
I կիսամյակ 2021-2022,2021,2022,4301,"Մուշտակամորթ հումք` պիտանի  մորթե իրերի արտադրության համար, ոչ անմշակ մորթի",հատ,10.0,1.1,0.0,0.0
I կիսամյակ 2021-2022,2021,2022,4302,Դաբաղած կամ մշակված մուշտակամորթի,կգ,227.1,8.1,0.2,0.0
I կիսամյակ 2021-2022,2021,2022,4302,Դաբաղած կամ մշակված մուշտակամորթի,հատ,237.0,3.0,4452.0,47.3
I կիսամյակ 2021-2022,2021,2022,4303,"Բնական մորթուց հագուստ, հագուստի պարագաներ եւ այլ իրեր բնական մորթուց",հատ,98.0,55.9,42.0,36.5
I կիսամյակ 2021-2022,2021,2022,4303,"Բնական մորթուց հագուստ, հագուստի պարագաներ եւ այլ իրեր բնական մորթուց",տոննա,3.7,2697.3,1.9,1302.7
I կիսամյակ 2021-2022,2021,2022,4304,Արհեստական մորթի եւ իրեր դրանից,կգ,432.9,5.9,4582.5,60.6
I կիսամյակ 2021-2022,2021,2022,4401,Վառելիքային փայտանյութ; թեփ եւ թափոն փայտանյութի,տոննա,88.1,160.3,112.3,111.9
I կիսամյակ 2021-2022,2021,2022,4402,Փայտածուխ,տոննա,351.0,166.5,262.2,264.0
I կիսամյակ 2021-2022,2021,2022,4403,Անտառանյութեր անմշակ,խմ,1036.0,240.3,432.5,115.5
I կիսամյակ 2021-2022,2021,2022,4404,Փայտանյութ տակառագործական; ցցագերան; անտառանյութ` բռնակի,տոննա,218.3,100.8,43.9,17.5
I կիսամյակ 2021-2022,2021,2022,4406,Փայտակոճեր երկաթուղային եւ տրամվայի գծերի համար,խմ,714.6,251.6,594.4,244.9
I կիսամյակ 2021-2022,2021,2022,4407,"Անտառանյութ` երկայնակի սղոցած կամ ճեղքած, ռանդած, >6 մմ հաստությամբ",հազ.խմ,121.2,2305.3,158.1,3387.1
I կիսամյակ 2021-2022,2021,2022,4408,"Թերթեր` երեսպատման, սոսնձած ֆաներայի, այլ շերտավոր փայտանյութի` <= 6մմ հաստությամբ",խմ,83.5,191.4,59.2,129.2
I կիսամյակ 2021-2022,2021,2022,4409,Սղոցանյութեր պրոֆիլավորված գծային տեսքով,կմ,3.8,8.7,15.5,12.4
I կիսամյակ 2021-2022,2021,2022,4409,Սղոցանյութեր պրոֆիլավորված գծային տեսքով,տոննա,2016.3,575.5,855.7,466.1
I կիսամյակ 2021-2022,2021,2022,4409,Սղոցանյութեր պրոֆիլավորված գծային տեսքով,քմ,6272.2,268.4,150.0,26.7
I կիսամյակ 2021-2022,2021,2022,4410,Փայտատաշեղային սալիկներ եւ նման սալիկներ փայտանյութից,հազ.խմ,37.5,9418.4,92.3,10526.7
I կիսամյակ 2021-2022,2021,2022,4411,Փայտանրբաթելային սալիկներ եւ նման սալիկներ փայտանյութից կամ այլ փայտացած նյութերից,հազ.քմ,3731.1,7036.5,2118.7,9648.7
I կիսամյակ 2021-2022,2021,2022,4412,"Սոսնձած նրբատախտակ, նրբատախտակային սալեր եւ նման նյութեր շերտավոր փայտանյութից",հազ.խմ,3.4,1459.2,36.6,4174.5
I կիսամյակ 2021-2022,2021,2022,4413,"Մամլած փայտանյութ բլոկների, սալիկների, չորսուների տեսքով",խմ,16.3,6.4,13.4,17.6
I կիսամյակ 2021-2022,2021,2022,4414,"Փայտե շրջանակներ նկարի, լուսանկարի, հայելու եւ համանման իրերի համար",տոննա,10.0,26.9,21.9,65.9
I կիսամյակ 2021-2022,2021,2022,4415,"Փայտե արկղ, զամբյուղ եւ նման տարողություն; կաբելի փայտե թմբուկ; տակդիր եւ այլ փայտե բեռնման վահան",տոննա,350.9,172.6,254.9,304.0
I կիսամյակ 2021-2022,2021,2022,4416,"Փայտե տակառ, գուռ, լայնաբերան տակառ եւ տակառագործ. այլ իրեր, տակառատախտակ",տոննա,2.1,20.2,30.0,176.2
I կիսամյակ 2021-2022,2021,2022,4417,"Գործիքներ, գործիքների հենամարմին փայտից; ավելի, խոզանակի բռնակ; կոշիկի փայտե կաղապար եւ առձգիչ",տոննա,87.0,58.8,87.1,85.8
I կիսամյակ 2021-2022,2021,2022,4418,"Իրեր ատաղձագործական եւ հյուսնի` փայտից, շինարարական պանել, մանրահատակ; տանիքի կավար եւ հերձան",հազ.քմ,29.9,586.5,33.0,1066.5
